<?xml version="1.0" encoding="UTF-8"?>

<indexes xmlns:xsi="http://www.w3.org/2001/XMLSchema-instance"
         xsi:noNamespaceSchemaLocation="index-conf.xsd">
    <index>
        <name>a</name>
        <table>1tb</table>
        <fields>
            <field columnFamily="f" qualifier="q1" maxLength="6" isLengthVariable="true" isOrderInverted="false"
                   formatter="com.cloudera.bigdata.analysis.dataload.index.formatter.LengthVariableValueFormatter"/>
        </fields>
    </index>    
    <index>
        <name>b</name>
        <table>1tb</table>
        <fields>
            <field columnFamily="f" qualifier="q2" maxLength="8" isLengthVariable="false" isOrderInverted="false"/>
        </fields>
    </index>
    <index>
        <name>c</name>
        <table>1tb</table>
        <fields>
            <field columnFamily="f" qualifier="q3" maxLength="6" isLengthVariable="true" isOrderInverted="false"
                   formatter="com.cloudera.bigdata.analysis.dataload.index.formatter.LengthVariableValueFormatter"/>
        </fields>
    </index>
    <index>
        <name>d</name>
        <table>1tb</table>
        <fields>
            <field columnFamily="f" qualifier="q4" maxLength="11" isLengthVariable="false" isOrderInverted="false"/>
        </fields>
    </index>
    <index>
        <name>e</name>
        <table>1tb</table>
        <fields>
            <field columnFamily="f" qualifier="q1" maxLength="6" isLengthVariable="true" isOrderInverted="false"
                   formatter="com.cloudera.bigdata.analysis.dataload.index.formatter.LengthVariableValueFormatter"/>
            <field columnFamily="f" qualifier="q3" maxLength="6" isLengthVariable="true" isOrderInverted="false"
                   formatter="com.cloudera.bigdata.analysis.dataload.index.formatter.LengthVariableValueFormatter"/>
        </fields>
    </index>
    <index>
        <name>f</name>
        <table>1tb</table>
        <fields>
            <field columnFamily="f" qualifier="q2" maxLength="8" isLengthVariable="false" isOrderInverted="false"/>
            <field columnFamily="f" qualifier="q4" maxLength="11" isLengthVariable="false" isOrderInverted="false"/>
        </fields>
    </index>
    <index>
        <name>g</name>
        <table>1tb</table>
        <fields>
            <field columnFamily="f" qualifier="q1" maxLength="6" isLengthVariable="true" isOrderInverted="false"
                   formatter="com.cloudera.bigdata.analysis.dataload.index.formatter.LengthVariableValueFormatter"/>
            <field columnFamily="f" qualifier="q2" maxLength="8" isLengthVariable="false" isOrderInverted="false"/>
            <field columnFamily="f" qualifier="q4" maxLength="11" isLengthVariable="false" isOrderInverted="false"/>
        </fields>
    </index>
    <index>
        <name>h</name>
        <table>1tb</table>
        <fields>
            <field columnFamily="f" qualifier="q2" maxLength="8" isLengthVariable="false" isOrderInverted="false"/>
            <field columnFamily="f" qualifier="q3" maxLength="6" isLengthVariable="true" isOrderInverted="false"
                   formatter="com.cloudera.bigdata.analysis.dataload.index.formatter.LengthVariableValueFormatter"/>
            <field columnFamily="f" qualifier="q4" maxLength="11" isLengthVariable="false" isOrderInverted="false"/>
        </fields>
    </index>
</indexes>